{"$id":"https://outerheavenx.github.io/citadel-of-vesper/schemas/npc.schema.json","$schema":"https://json-schema.org/draft/2020-12/schema","additionalProperties":false,"description":"NPC definition: safe-room placement, relocation rules, and a data-driven dialogue tree.","properties":{"dialogue":{"additionalProperties":false,"properties":{"defaultStart":{"type":"string"},"nodes":{"additionalProperties":{"additionalProperties":false,"properties":{"choices":{"items":{"additionalProperties":false,"properties":{"next":{"description":"Node id to jump to, or null to end the conversation.","type":["string","null"]},"quest":{"additionalProperties":false,"description":"Quest stage to set when this choice is picked.","properties":{"questId":{"type":"string"},"stage":{"type":"string"}},"required":["questId","stage"],"type":"object"},"setFlag":{"additionalProperties":false,"description":"GameState flag to set when this choice is picked.","properties":{"flag":{"type":"string"},"value":{}},"required":["flag","value"],"type":"object"},"text":{"type":"string"}},"required":["text","next"],"type":"object"},"minItems":1,"type":"array"},"onEnter":{"description":"Flags set when this node is first shown.","items":{"additionalProperties":false,"properties":{"flag":{"type":"string"},"value":{}},"required":["flag","value"],"type":"object"},"type":"array"},"text":{"type":"string"}},"required":["text","choices"],"type":"object"},"type":"object"},"variants":{"description":"Alternate entry nodes chosen by flag (first truthy match wins).","items":{"additionalProperties":false,"properties":{"flag":{"type":"string"},"start":{"type":"string"}},"required":["flag","start"],"type":"object"},"type":"array"}},"required":["defaultStart","nodes"],"type":"object"},"id":{"pattern":"^[a-z0-9_]+$","type":"string"},"merchantId":{"description":"When set, this NPC opens the matching merchant's shop.","type":["string","null"]},"name":{"type":"string"},"portrait":{"type":"string"},"relocate":{"description":"Later entries win: when whenFlag is truthy the NPC moves there.","items":{"additionalProperties":false,"properties":{"roomId":{"pattern":"^[a-z0-9_]+$","type":"string"},"whenFlag":{"type":"string"},"x":{"type":"number"},"y":{"type":"number"}},"required":["whenFlag","roomId"],"type":"object"},"type":"array"},"roomId":{"pattern":"^[a-z0-9_]+$","type":"string"},"title":{"type":"string"},"x":{"type":"number"},"y":{"type":"number"},"sprite":{"description":"Art sprite id; idle texture key is '<sprite>_idle' (assets/npcs/).","pattern":"^[a-z0-9_]+$","type":"string"}},"required":["id","name","title","roomId","dialogue"],"title":"Npc","type":"object"}
