[
  {
    "dialogue": {
      "defaultStart": "greet",
      "nodes": {
        "greet": {
          "choices": [
            {
              "next": "gate",
              "text": "\"What is this place?\""
            },
            {
              "next": "warden_hint",
              "text": "\"What should I watch for beyond the gate?\""
            },
            {
              "next": null,
              "text": "\"I'll be going.\""
            }
          ],
          "onEnter": [
            {
              "flag": "met_old_tam",
              "value": true
            }
          ],
          "text": "Another one through the Threshold. Mind the step, lad — the stones remember feet better than names. I'm Tam. I kept this gate when it had a garrison, and I keep it now that it has me."
        },
        "gate": {
          "choices": [
            {
              "next": "greet",
              "text": "\"Tell me of the Ruin.\""
            },
            {
              "next": null,
              "text": "\"Understood.\""
            }
          ],
          "text": "The Moonlit Gate was the Citadel's front door, back when the moon still rose round and honest. Then came the Ruin — one night the sky tore like wet parchment, and everything the moonlight touched turned hollow. The Citadel has been picking at the wound ever since."
        },
        "warden_hint": {
          "choices": [
            {
              "next": "greet",
              "text": "\"Back.\""
            },
            {
              "next": null,
              "text": "\"I'll remember that.\""
            }
          ],
          "text": "Past the Lantern Court stands the Warden's Chapel. The Chapel Warden still rings its bell for a congregation of dust. When you hear the toll — move. The bell is not a warning, it's the blow itself."
        }
      },
      "variants": []
    },
    "id": "old_tam",
    "sprite": "old_tam",
    "merchantId": null,
    "name": "Old Tam",
    "portrait": "old_tam",
    "relocate": [],
    "roomId": "moonlit_gate_001",
    "title": "Threshold Keeper",
    "x": 96,
    "y": 200
  },
  {
    "dialogue": {
      "defaultStart": "greet",
      "nodes": {
        "greet": {
          "choices": [
            {
              "next": "ruin_lore",
              "text": "\"What do you know of the Ruin?\""
            },
            {
              "next": "leap_hint",
              "text": "\"Have you seen anything... unreachable?\""
            },
            {
              "next": null,
              "text": "\"Keep the lanterns lit, Sister.\""
            }
          ],
          "onEnter": [
            {
              "flag": "met_sister_ansel",
              "value": true
            }
          ],
          "text": "Welcome to the Lantern Court, traveler. I am Ansel, keeper of these flames. While one lantern burns here, the Gate remembers what it was. Sit a moment. The dark can wait; it is patient, but so am I."
        },
        "ruin_lore": {
          "choices": [
            {
              "next": "greet",
              "text": "\"Back.\""
            },
            {
              "next": null,
              "text": "\"I won't forget.\""
            }
          ],
          "text": "The Ruin was not a war. Wars end. On that night the moon went hollow — a ring of light with nothing inside — and its light unmade things instead of revealing them. Dogs, scholars, whole chapels: unmade, then remade wrong. We call them the Hollow now."
        },
        "leap_hint": {
          "choices": [
            {
              "next": "greet",
              "text": "\"Back.\""
            },
            {
              "next": null,
              "text": "\"A second leap. I'll remember.\""
            }
          ],
          "text": "Ah — a seeker after high places. Above the Reliquary's tall shelves there is an alcove no stair was ever built to reach, and the reliquaries inside it were never looted. The old order knew one secret worth the keeping: leap, and at the very crown of your leap — leap again. The moon teaches; the body remembers."
        },
        "post_warden": {
          "choices": [
            {
              "next": "ruin_lore",
              "text": "\"Tell me of the Ruin again.\""
            },
            {
              "next": null,
              "text": "\"The Court stands because of you.\""
            }
          ],
          "text": "The bell has gone silent, and the Chapel breathes easier. You did that. The Court will keep a lantern burning with your name on it — Lucien Vale, who quieted the Warden."
        }
      },
      "variants": [
        {
          "flag": "boss_defeated_chapel_warden",
          "start": "post_warden"
        }
      ]
    },
    "id": "sister_ansel",
    "sprite": "sister_ansel",
    "merchantId": null,
    "name": "Sister Ansel",
    "portrait": "sister_ansel",
    "relocate": [],
    "roomId": "moonlit_gate_002",
    "title": "Keeper of the Lantern Court",
    "x": 320,
    "y": 200
  },
  {
    "dialogue": {
      "defaultStart": "greet",
      "nodes": {
        "greet": {
          "choices": [
            {
              "next": "wares",
              "text": "\"Show me your wares.\""
            },
            {
              "next": "gossip",
              "text": "\"Heard anything worth knowing?\""
            },
            {
              "next": null,
              "text": "\"Another time, Corvus.\""
            }
          ],
          "onEnter": [
            {
              "flag": "met_corvus_vane",
              "value": true
            }
          ],
          "text": "Boots! Boots on the stones, coin in the air — Corvus Vane sees all, sells most. Everything in this pack was acquired honestly, which is to say: I paid for it, and the previous owners are in no position to complain."
        },
        "wares": {
          "choices": [
            {
              "next": "greet",
              "text": "\"Back.\""
            },
            {
              "next": null,
              "text": "\"Let me browse.\""
            }
          ],
          "text": "Tonics, draughts, a coat that has survived three owners — browse, browse. And if the Warden's bell ever stops ringing, come find me. I keep one very special trinket for heroes."
        },
        "gossip": {
          "choices": [
            {
              "next": "greet",
              "text": "\"Back.\""
            },
            {
              "next": null,
              "text": "\"Good to know.\""
            }
          ],
          "text": "Word travels faster than feet in the Gate. They say the Sunken Chapel's teleporter still works — one of the old transit circles. And they say something in the Hollow Keep pays well for silence. I pay well for gossip, so we're even."
        },
        "post_warden": {
          "choices": [
            {
              "next": "wares",
              "text": "\"About those wares...\""
            },
            {
              "next": null,
              "text": "\"Pleasure doing business.\""
            }
          ],
          "text": "The Warden's bell, silent! I told you I keep one special trinket for heroes — a moonstone charm, warm as a held hand. It's yours if your purse agrees."
        }
      },
      "variants": [
        {
          "flag": "boss_defeated_chapel_warden",
          "start": "post_warden"
        }
      ]
    },
    "id": "corvus_vane",
    "sprite": "corvus_vane",
    "merchantId": "corvus_vane",
    "name": "Corvus Vane",
    "portrait": "corvus_vane",
    "relocate": [],
    "roomId": "moonlit_gate_002",
    "title": "Moonlit Gate Peddler",
    "x": 400,
    "y": 200
  },
  {
    "dialogue": {
      "defaultStart": "greet",
      "nodes": {
        "greet": {
          "choices": [
            {
              "next": "chapel",
              "text": "\"What is this chapel?\""
            },
            {
              "next": "warden_tactics",
              "text": "\"How does one fight the Warden?\"",
              "quest": {
                "questId": "chapel_warden_hunt",
                "stage": "heard"
              }
            },
            {
              "next": null,
              "text": "\"The circle hums. I'll use it.\""
            }
          ],
          "onEnter": [
            {
              "flag": "met_maribel_quill",
              "value": true
            }
          ],
          "text": "Shh — listen. The transit circle hums beneath us; it remembers every foot that ever stood here. I'm Maribel. I came to study the Sunken Chapel and stayed to apologize to it."
        },
        "chapel": {
          "choices": [
            {
              "next": "greet",
              "text": "\"Back.\""
            },
            {
              "next": null,
              "text": "\"I'll be careful.\""
            }
          ],
          "text": "This chapel sank a full storey in the Ruin and nobody rebuilt it — the Citadel just built around the hole. The transit circle is the only honest thing left here. Step in, think of where you've been, and the moon does the walking."
        },
        "warden_tactics": {
          "choices": [
            {
              "next": "greet",
              "text": "\"Back.\""
            },
            {
              "next": "chapel",
              "text": "\"Tell me of the chapel instead.\""
            },
            {
              "next": null,
              "text": "\"After the toll, not before. Got it.\""
            }
          ],
          "text": "The Warden's Chapel lies past the Weeping Gallery. He was carved to guard the dead, and guarding is all he has left. When his bell tolls, the sound itself strikes — don't brace, don't pray, just be elsewhere. Strike in the silence after. And when he falls... come tell me. I owe this chapel an ending."
        },
        "post_warden": {
          "choices": [
            {
              "next": "chapel",